{
  "id": "usdt-ethereum",
  "chain": "ethereum",
  "address": "0xdAC17F958D2ee523a2206206994597C13D831ec7",
  "symbol": "USDT",
  "name": "Tether USD",
  "decimals": 6,
  "issuer": {
    "name": "Tether Limited",
    "jurisdiction": "British Virgin Islands",
    "website": "https://tether.to",
    "regulated": false
  },
  "archetype": "fiat-stablecoin",
  "expectedCapabilities": [
    {
      "capability": "mint-authority",
      "justification": "Issues and redeems against reserves.",
      "constrainedBy": "Published attestations"
    },
    {
      "capability": "transfer-restriction",
      "justification": "Operates an on-chain blacklist used for law enforcement freezes.",
      "constrainedBy": "Issuer policy and law enforcement requests"
    },
    {
      "capability": "admin-authority",
      "justification": "Owner-controlled contract, the issuer's operational design.",
      "constrainedBy": "Issuer-controlled, no timelock"
    },
    {
      "capability": "freeze-authority",
      "justification": "Operates an on-chain blacklist used for law enforcement freezes of individual holders. Tether has exercised this.",
      "constrainedBy": "Issuer policy and law enforcement requests"
    }
  ],
  "evidence": [
    {
      "kind": "onchain",
      "detail": "symbol() = USDT, decimals() = 6, 11075 bytes of code.",
      "observedAt": "2026-07-22"
    },
    {
      "kind": "documentation",
      "detail": "Tether publishes attestation reports and documents its blacklist function.",
      "url": "https://tether.to/en/transparency/"
    },
    {
      "kind": "onchain",
      "detail": "isBlackListed(address) answers eth_call, so the per-address blacklist mechanism is present. Read directly on 2026-09-06 via the pattern that reads it.",
      "observedAt": "2026-09-06"
    },
    {
      "kind": "onchain",
      "detail": "basisPointsRate() and maximumFee() answer eth_call, both 0, and setParams(uint256,uint256) is in the bytecode: the owner can set a per-transfer fee within limits fixed in the contract. Not expected, because the token functions and complies without it, so it is scored as present.",
      "observedAt": "2026-09-06"
    }
  ],
  "caveats": [
    "Being listed here does not mean the token cannot lose value or depeg.",
    "It means the named capabilities are structurally expected, not that the issuer is beyond criticism.",
    "An expected capability is still a capability. The issuer can use it.",
    "Tether's issuer is not subject to the same regulatory supervision as Circle. The expected capabilities are identical, the constraints on them are not.",
    "Admin authority here is not timelocked, unlike the governance tokens in this registry."
  ],
  "verifiedAt": "2026-07-22",
  "reviewDue": "2027-07-22",
  "approvedBy": "decrypto",
  "commercialRelationship": null
}
