{
  "id": "link-ethereum",
  "chain": "ethereum",
  "address": "0x514910771AF9Ca656af840dff83E8264EcF986CA",
  "symbol": "LINK",
  "name": "ChainLink Token",
  "decimals": 18,
  "issuer": {
    "name": "Chainlink Labs",
    "jurisdiction": "Decentralised",
    "website": "https://chain.link",
    "regulated": false
  },
  "archetype": "utility",
  "expectedCapabilities": [],
  "evidence": [
    {
      "kind": "onchain",
      "detail": "symbol() = LINK, decimals() = 18. Standard ERC-20, no expected privileged capabilities claimed.",
      "observedAt": "2026-07-22"
    },
    {
      "kind": "documentation",
      "detail": "Chainlink Labs public documentation.",
      "url": "https://chain.link"
    }
  ],
  "caveats": [
    "No capabilities are pre-approved for this token. It is scored on structure alone.",
    "Presence in this registry confirms identity and archetype. It does not grant any capability exemption."
  ],
  "verifiedAt": "2026-07-22",
  "reviewDue": "2027-07-22",
  "approvedBy": "decrypto",
  "commercialRelationship": null
}
