{
  "id": "aave-ethereum",
  "chain": "ethereum",
  "address": "0x7Fc66500c84A76Ad7e9c93437bFc5Ac33E2DDaE9",
  "symbol": "AAVE",
  "name": "Aave Token",
  "decimals": 18,
  "issuer": {
    "name": "Aave DAO",
    "jurisdiction": "Decentralised",
    "website": "https://aave.com",
    "regulated": false
  },
  "archetype": "governance",
  "expectedCapabilities": [
    {
      "capability": "upgradeability",
      "justification": "The token is a proxy, upgradeable by Aave governance.",
      "constrainedBy": "Governance vote plus timelock"
    }
  ],
  "evidence": [
    {
      "kind": "onchain",
      "detail": "symbol() = AAVE, decimals() = 18, 2491 bytes, consistent with a thin proxy forwarding to logic.",
      "observedAt": "2026-07-22"
    },
    {
      "kind": "documentation",
      "detail": "Aave governance controls the proxy admin through its executor contracts.",
      "url": "https://docs.aave.com/governance/"
    }
  ],
  "caveats": [
    "A live admin behind a timelock is still a live admin.",
    "This entry does not assess governance capture or voting concentration."
  ],
  "verifiedAt": "2026-07-22",
  "reviewDue": "2027-07-22",
  "approvedBy": "decrypto",
  "commercialRelationship": null
}
